{"$schema":"http://json-schema.org/draft-07/schema#","additionalProperties":true,"properties":{"baseline":{"type":"object"},"crossings":{"items":{"properties":{"after":{"type":"integer"},"before":{"type":"integer"},"threshold":{"type":"integer"},"title":{"type":"string"}},"required":["title","threshold","before","after"],"type":"object"},"type":"array"},"generated_at":{"type":"string"},"history":{"type":"array"},"method":{"type":"string"},"movers":{"items":{"properties":{"after":{"type":"integer"},"before":{"type":"integer"},"delta":{"type":"integer"},"per_day":{"type":["number","null"]},"title":{"type":"string"}},"required":["title","before","after","delta"],"type":"object"},"type":"array"},"new_uploads":{"type":"array"},"next_up":{"type":"array"},"removed":{"type":"array"},"service":{"const":"aster-signal"},"summary":{"properties":{"crossings":{"type":"integer"},"movers":{"type":"integer"},"new_uploads":{"type":"integer"},"newest_upload":{"type":"object"},"removed":{"type":"integer"},"total_delta":{"type":"integer"},"total_plays":{"type":"integer"},"tracks_watched":{"type":"integer"}},"required":["tracks_watched","total_plays","new_uploads","movers","crossings"],"type":"object"},"version":{"type":"string"},"watch_version":{"type":"string"}},"required":["version","generated_at","summary","new_uploads","movers","crossings"],"title":"Signal 2.0 watch file","type":"object"}